Title,Slug,Address,City,State,Country,Latitude,Longitude,Postal Code,Description,Phone,Website,Facebook,Twitter,Linkedin,Youtube id,Feature Image,Gallery Images,,
Al Raha Ayurvedic Women'S Health Spa,Al-Raha-Ayurvedic-WomenS-Health-Spa,"AL RAHA Ayurvedic, Physical Therapy Clinic, Fujairah Trade Center - Hamad Bin Abdulla Rd - FujairahAL RAHA AyurvedicPhysical Therapy ClinicFujairahTrade Center - Hamad Bin Abdulla Rd - Fujairah",Fujairah,Fujairah,UAE,25.1213415,56.3310964,,Al Raha Ayurvedic Women'S Health Spa is a Ayurvedic clinic in Fujairah,055 813 7450,alrahaayurvedic.com,https://www.facebook.com/alrahaayurvedicspa/?ref=bookmarks,,,,,,,
Kottakkal Ayurvedic Treatment Centre,Kottakkal-Ayurvedic-Treatment-Centre,"Al Hanaa Center, Al Mankhool Road, Al Jaffilia - Al Satwa - DubaiAl Hanaa CenterAl Mankhool RoadAlJaffilia - Al Satwa - Dubai",Dubai,Dubai,UAE,25.2366939,55.2798332,,Kottakkal Ayurvedic Treatment Centre is a Ayurvedic clinic in Dubai,04 332 0333,kottakkalayurveda.ae,https://www.facebook.com/kottakkalayurvedacenter,https://twitter.com/ayurdubai,,,,,,
Al Shifa Ayurvedic Treatment Centre,Al-Shifa-Ayurvedic-Treatment-Centre,Near Safeer Hypermarket - ???? ??????? - Al Rashidiya 1 - AjmanNear Safeer Hypermarket - ???? ??????? - Al Rashidiya 1 - AjmanNearSafeer Hypermarket - ???? ??????? - Al Rashidiya 1 - Ajman,Ajman,Ajman,UAE,25.3929771,55.4564803,,Al Shifa Ayurvedic Treatment Centre is a Ayurvedic clinic in Ajman,06 740 8646,alshifaayurveda.ae,https://www.facebook.com/alshifaayurvediccenter,https://twitter.com/share,,,,,,
Alfalah Physiotherapy Centre,Alfalah-Physiotherapy-Centre,Zone 1 - E6 - Abu DhabiZone 1 - E6 - Abu DhabiZone1 - E6 - Abu Dhabi,Abu Dhabi,Abu Dhabi,UAE,24.489501,54.3583801,,Alfalah Physiotherapy Centre is a Ayurvedic clinic in Abu Dhabi,02 644 8521,alfalahayurveda.com,https://www.facebook.com/alfalahayurveda,,,,,,,
Kerala Ayurvedic Center Llc,Kerala-Ayurvedic-Center-Llc,"Roof Floor, Moh'd Ibrahim Siddiqi Building, Opposite Spinneys - DubaiRoof FloorMoh'd Ibrahim Siddiqi BuildingOppositeSpinneys - Dubai",Dubai,Dubai,UAE,25.2484433,55.3011414,,Kerala Ayurvedic Center Llc is a Ayurvedic clinic in Dubai,04 396 6630,keralaayurvedicdubai.com,https://www.facebook.com/keralaayurvedicdubai/,,,,,,,
Kottakkal Ayurvedic Centre,Kottakkal-Ayurvedic-Centre,Gurfa Road - FujairahGurfa Road - FujairahGurfaRoad - Fujairah,Fujairah,Fujairah,UAE,25.1227962,56.3554029,,Kottakkal Ayurvedic Centre is a Ayurvedic clinic in Fujairah,09 222 9390,,,,,,,,,
Ayurcare Relax Center,Ayurcare-Relax-Center,"Al Fulaya Plaza Nakheel, Kharan Road, Opp.Yasmin Village - Ras al KhaimahAl Fulaya Plaza NakheelKharan RoadOpp.YasminVillage - Ras al Khaimah",Ras al Khaimah,Ras al Khaimah,UAE,25.7390986,55.9787802,,Ayurcare Relax Center is a Ayurvedic clinic in Ras al Khaimah,052 750 4263,,,,,,,,,
